{
  "type": "delta",
  "id": "01H9Z0X8K3F0T3B0S0V0W0X0Y4",
  "ts": 1752480010400,
  "body": {
    "from_revision": 125,
    "to_revision": 128,
    "events": [
      {
        "event_type": "task.event",
        "event": {
          "device_id": "mac-quintin-01",
          "device_seq": 55,
          "task_id": "run-2f9a",
          "kind": "progress",
          "occurred_at": 1752480004000,
          "percent": 40,
          "step": "uploading archives"
        }
      },
      {
        "event_type": "message.event",
        "event": {
          "device_id": "mac-quintin-01",
          "device_seq": 56,
          "message_id": "mac-quintin-01:56",
          "level": "info",
          "text": "Archive 3 of 5 uploaded",
          "occurred_at": 1752480006000
        }
      },
      {
        "event_type": "config.event",
        "event": {
          "kind": "automation.upserted",
          "automation_id": "auto-disk-watch",
          "automation": {
            "automation_id": "auto-disk-watch",
            "name": "Disk space watch",
            "executor_kind": "script",
            "schedule": { "kind": "interval", "every_seconds": 300 },
            "state": "active"
          },
          "occurred_at": 1752480008000
        }
      }
    ]
  }
}
